song_id,artist,title,lyrics,emotion
80,Drake,Pop Style,"
Tell my mom I love her if I do not make it (do not make it)

Got so many chains they call me Chaining Tatum

(They do, they do)

And I like to finish what you think you started

Man you boys just got to Hollywood, you boys just started

You don't know what you just started

All I do is hang with the young and heartless

All this for my family, man, I try my hardest

It's all I ever did and look where it got him

Yeah, you've been on my mind lately

You've still got my number, girl you need to call me

I feel like they wanna see me learn the hard way

But you know I always handle that one my way

Girl let me rock, rock, rock, rock, rock your body

Justin Timberlake and then I hit the highway

I can't trust no fuckin' body

They still out to get me cause they never got me


They still out to get me, I don't get it

I can not be got, and that's a given

Give a real nigga the number one

Even though I got like twenty-one

Cannot be me I'm a one-of-one

Schooling your ass like 101

They been out here tryna slide on me

They been out here telling lies on me

Everybody looking out for themself

But they still got they eyes on me

See me putting in the hard work now, aye

Momma doesn't have to call work now, aye

I decide when I start work now, aye

Problems hit the gym, they all work out

MVP, MVP, oh-nine all the way to sixteen

Even next season looking like a breeze

Lot of y'all ain't built for the league, yeah

Trade you off the team while you in your sleep, yeah

Y'all showed me that nothing's guaranteed

And you don't know what you started

My friend's chain so big that he look like the artist

I can't trust no fuckin' body

They still out to get me cause they never got me ",
248,Kendrick Lamar,Love,"
If I didn't ride blade on curb, would you still (love me)

If I made up my mind at work would you still (love me)

Keep it a hundred, I'd rather you trust me than to (love me)

Keep it a whole one hund', don't got you I got nothing


Ay, I got something (I got something)

Hol' up, we gon' function, no assumptions

Feeling like Tyson wit' it, knock it out out twice

I'm with it, only for the night, I'm kidding

Only for life, you're a homie for life

You're a homie for life, let's get it

Hit that shoulder lean, I know what comin' over mean

Backstroke oversea, I know what you need

Already on ten, our money come in

All feeling go out, this feeling don't drought

This party won't end",
687,Burl Ives,A Holly Jolly Christmas,"
Oh

Ho

The mistletoe 

Hung where you can see


Somebody waits for you

Kiss her once for me

Have a holly jolly Christmas

And in case you didn't hear",
55,Kevin Gates,2 Phones,"
Button start the foreign, oh my God I'm gorgeous

I just put the key inside my pocket park

It might not get to see, this a new Ferrari

Man in the mirror, how you choose to bother

Someone said they callin', I don't feel like talkin'

Everything is different returned the way I bought it

Phone be interrupting me while I'm recordin'

Phone be making women feel they unimportant

Call my dog, he say it's all the way retarded

Keep the oil cause I am not using the Foreman

Kitchen, I just finished up new performance

Hater, wish you well

I got clientele

I just got it off the scale


I got two phones, one for the plug and one for the load

I got two phones, one for the bitches and one for the dough

Think I need two more, line bumpin' I'm ring, ring, ringin'

Countin' money while they ring, ring, ringin'

Trap jumpin' I'm ring, ring, ringin'

I got two phones, one for the plug and one for the load

I got two phones, one for the bitches and one for the dough

Think I need two more, line bumpin' I'm ring, ring, ringin'

Countin' money while they ring, ring, ringin'

Trap jumpin' I'm ring, ring, ringin'",
285,Kenny Chesney,Get Along,"
Get along while we can

Always give love the upper hand

Paint a wall, learn to dance

Call your mom, buy a boat

Drink a beer, sing a song

Make a friend, can't we all get along?


Saw a model on a billboard, 1-800 get to know me

Wondered was she photoshopped, or were her eyes really that lonely?

Did she leave her hometown thinkin' she'd end up in L.A.?

Did she break down in the desert and get stuck beside the highway?",
593,Cole Swindell,Single Saturday Night,"
Sitting over in the corner, baby, I saw

Pretty red lips, working on a white claw

Shaking to a little, shook me all night long

And I thought, ""Man, what a beautiful sight""

Ain’t a morning you don't wake up in my shirt now

Even holding hands walking out of church now

Who'd of thought, baby, looking back that

That would be my last single Saturday night?

Yeah

My last single Saturday night


And now when I’m out, having a drink or two

If they see me, uh, well, they see you

'Cause, girl, I got you by my side

Every single Saturday night, yeah

Every now and then, the boys tell me they miss me

Oh but they all get it 'cause they were right there with me

Yeah with me, when",
604,Jack Harlow,First Class,"
I could see the whole city from this balcony

Back in 2019, I was outside freely, but now they got it out for me

I don't care what frat that you was in, you can't alpha me, keep dreaming

Pineapple juice, I give her sweet, sweet, sweet semen

I know what they like so I just keep cheesin'

Hard drive full of heat seekin'

Tryna come the same day as Jack, rethink it

Y'all don't need Givenchy, you need Jesus

Why do y'all sleep on me? I need reasons

Uh, I got plaques in thе mail, peak season

Shout out to my UPS workers, makin' surе I receive 'em

You could do it too, believe it


I been a G, throw up the L

Sex in the A.M., uh-huh

O-R-O-U-S, yeah

And I could put you in first class

Up in the sky, mm, mm

I could put you in first class

Up in the—, up-up in the—",
170,Kane Brown,What Ifs,"
What if I was made for you and you were made for me

What if this is it, what if it's meant to be

What if I ain't one of them fools just playin' some game

What if I just pulled you close, what if I leaned in

And the stars line up and it's our last first kiss

What if one of these days baby I'd go and change your name

What if I loved all these what ifs away


What if the sky falls (sky falls) or the sun stops burnin'

We could worry about them what ifs 'til the world stops turnin'

Or I could kiss you (you should kiss me), what if you liked it (bet I'd like it)

Well we ain't never gonna know unless we try it",
628,Post Malone,One Right Now,"
Said you wanna have my babies

I fucked you so good, you should pay me

Don't call me ""baby"" when you did me so wrong

(When you did me so wrong)

But I got over what you did already

Body for a body, so petty

How many of your friends fit in my Rolls? (Can you fit in my Rolls?)

Bought you a new face, you should call me ""Dad,"" baby

Hermès, but you dropped the bag, baby

Truth is, maybe one's just not еnough

[Chorus: Post Malone & The Weeknd]

You say you love me, but I don't care

That I brokе my hand on the same wall

That you told me that he fucked you on (That he fucked you on)

You think it's so easy fuckin' with my feelings (Feelings)

I got one comin' over and one right now (Uh)

One right now (Yeah, yeah, yeah)

(One right now, one right now, oh yeah)

I got one comin' over and one right now (Yeah, yeah, yeah)

(One right now, one right now, oh)

I got one comin' over and one right now


You're a stain on my legacy

We can't be friends, can't be family (Oh)

You probably fuck all my enemies (Oh)

I can't let you be next to me

Oh, you belong to the world now

So just me leave me alone now

We're not in touch no more",
79,Ellie Goulding,On My Mind,"
And now I don't understand it

You don't mess with love, you mess with the truth

And I know I shouldn't say it

But my heart don't understand


Why I got you on my mind

Why I got you on my mind

Why I got you on my mind

Why I got you on my mind

But my heart don't understand

Why I got you on my mind

Why I got you on my mind

Why I got you on my mind

Why I got you on my mind",
225,Halsey,Bad at Love,"
I believe, I believe, I believe, I believe

That we're meant to be

But jealousy, jealousy, jealousy, jealousy

Get the best of me

Look, I don't mean to frustrate, but I

Always make the same mistakes, yeah I

Always make the same mistakes 'cause


I'm bad at love (ooh-ooh)

But you can't blame me for tryin'

You know I'd be lyin' sayin'

You were the one (ooh-ooh)

That could finally fix me

Lookin' at my history

I'm bad at love",
262,Demi Lovato,Sorry Not Sorry,"
Now payback is a bad bitch

And baby, I'm the baddest

You fuckin' with a savage

Can't have this, can't have this (ahhhh)

And it'd be nice of me to take it easy on ya, but nahhhh


Baby, I'm sorry (I'm not sorry)

Baby, I'm sorry (I'm not sorry)

Being so bad got me feeling so good

Showing you up like I knew that I would

Baby, I'm sorry (I'm not sorry)

Baby, I'm sorry (I'm not sorry)

Feeling inspired 'cause the tables have turned

Yeah, I'm on fire and I know that it burns",
554,AJR,Bang!,"
So put your best face on, everybody

Pretend you know this song, everybody

Come hang

Let's go out with a bang (bang! bang! bang!)

I'm way too young to lie here forever

I'm way too old to try so whatever

Come hang

Let's go out with a bang (bang! bang! bang!)


Feel like I'm gonna puke 'cause my taxes are due

Do my password begin with a one or a two?

Been a hell of a ride but I'm thinkin' it's time

To grow (bang! bang! bang!) (metronome)",
895,Cody Johnson,The Painter,"
I don't remember

Life before she came into the picture

Brought the beauty I was missin' with her

Showed me colors I ain't ever seen

She took chances

With every wall I built, she saw a canvas

I thank God every day for how He made her

My life was black and white, but she's the painter


She reminds me that it ain't too late to start again

Fine is good, but you need some blue every now and then

How'd I live so long without her reckless touch?",
577,Coi Leray,No More Parties,"
I'm too busy getting this money, counting this cheddar (Counting this cheddar)

My daddy let me down, but I promise you, I won't let up (I won't lеt up)

I wanna say fuck that man but the shit won't make me bеtter (Make me better)

Me and my brother still beefin' right now, 'cause he ain't get that letter

Numb to the pain

Yeah, and I'm like yeah

Fuck everybody, yeah, I can't trust nobody

I ain't even really tryna party

Don't invite me to no party


Bitch, pull-up in that mhm

It's so mhm (Mhm)

They ask, how I get that ooh?

I'm a hustla', baby (Yeah)

You must not know me, baby (Know me baby, know me baby)",
130,Niall Horan,Slow Hands,"
Slow, slow hands

Like sweat dripping down our dirty laundry

No, no chance

That I'm leaving here without you on me

I, I know

Yeah, I already know that there ain't no stopping

Your plans and those

Slow hands (woo)

Slow hands


I just wanna take my time

We could do this, baby, all night (yeah)

'Cause I want you bad

Yeah, I want you, baby",
98,One Direction,Perfect,"
But if you like causing trouble up in hotel rooms

And if you like having secret little rendezvous

If you like to do the things you know that we shouldn't do

Baby, I'm perfect

Baby, I'm perfect for you


And if you like midnight driving with the windows down

And if you like going places we can't even pronounce

If you like to do whatever you've been dreaming about

Baby, you're perfect

Baby, you're perfect

So let's start right now",
249,Childish Gambino,This Is America,"
We just wanna party (yeah)

Party just for you (yeah)

We just want the money (yeah)

Money just for you (you)

I know you wanna party (yeah)

Party just for me (yeah)

Girl, you got me dancin' (yeah, girl, you got me dancin')

Dance and shake the frame (you)


This is America

Don't catch you slippin' up

Don't catch you slippin' up

Look what I'm whippin' up

This is America (woo)

Don't catch you slippin' up

Don't catch you slippin' up

Look what I'm whippin' up",
110,DJ Khaled,I'm the One,"
Oh-eh-oh-oh-oh, oh-eh-oh

I'm the one

Oh-eh-oh-oh-oh, oh-eh-oh

I'm the only one

Oh-eh-oh-oh-oh, oh-eh-oh

I'm the one

Oh-eh-oh-oh-oh, oh-eh-oh

I'm the only one

Yeah, yeah!


Quavo!

I'm the one that hit that same spot (hit it)

She the one that bring them rain drops (rain drops)

We go back, remember criss-cross and hopscotch? (hopscotch)

You the one that hold me down when the block's hot (hot)

I make your dreams come true when you wake up (dream)

And your look's just the same without no make-up

Had to pull up on your mama, see what you're made of (mama)

Ain't gotta worry 'bout 'em commas 'cause my cake up

You can run inside my life from that fame bus

'Cause I promise when we step out you'll be famous

Modern day Bonnie and Clyde what they named us

'Cause when we pull up (prr prr) all angles",
415,Justin Bieber,Intentions,"
Shout-out to your mom and dad for makin' you

Standin' ovation, they did a great job raisin' you

When I create, you're my muse

The kind of smile that makes the news

Can't nobody throw shade on your name in these streets

Triple threat, you a boss, you a bae, you a beast

You make it easy to choose

You got a mean touch, I can't refuse (No, I can't refuse it)


Picture perfect, you don't need no filter

Gorgeous, make 'em drop dead, you a killer

Shower you with all my attention

Yeah, these are my only intentions

Stay in the kitchen cookin' up, got your own bread

Heart full of equity, you're an asset

Make sure that you don't need no mentions

Yeah, these are my only intentions",
719,Toosii,Favorite Song,"Yeah, I'm on the stage right now
Singin' your favorite song
Look in the crowd
And you're nowhere to be found as they sing along
I say you look good without no makeup
No lashes, even better when you wake up

Uh-uh-uh

I see the look on your face

I see you hidin' the hate

I see you lookin' for someone to scoop you right off of your feet

You wanna ride in a Wraith

You wanna go out on dates

You want somebody to come bring you flowers

Someone to talk to for hours

Wash your back while y'all sit in the shower, yeah

Someone to tell you, ""You're beautiful""

Someone to tell you and mean it

Someone to tell you, ""I love you"" every day

And don't got a reason

You want someone to bring you peace, uh

Someone to help you sleep, yeah

Someone to pick you up when you're feelin' down, feelin' lonely

Need somebody who can make it better

Somebody who can open up those gates

Open up those gates to your heart

Only if you'll let me

I'm on the stage right now

Singin' your favorite song

Look in the crowd

And you're nowhere to be found as they sing along

I say you look good without no makeup

No lashes even better when you wake up

Uh-uh-uh

I see the look on your face

I see you lookin' for peace

I see you tired of the hurt

Tired of the pain

Tired of the nights where you can't get no sleep

I see you're tired thinkin' 'bout if he cheat

See you're tired thinkin' 'bout if you leavin'

See you're tired of bein' so tired

And you damn sure ain't gettin' even

Need somebody

Who can make it better

Somebody

Who can open up those gates

Open up those gates to your heart

Only if you'll let me

I'm on the stage right now

Singin' your favorite song

Look in the crowd

And you're nowhere to be found as they sing along

I say you look good without no makeup

No lashes even better when you wake up

Uh-uh-uh",
472,Lil Baby,Emotionally Scarred,"
Young age, learned how to get paid (We gon' get the money)

Big stage, long way from Section 8 (Ballin' other countries)

Big wave, he gon' have to get saved (Big old wave)

Ridin' in the foreign, chiefin' on the forest

I know I wasn't there for you, at least I said I'm sorry

You know what it was, I told you that I was heartless

I'm emotionally scarred, that ain't even your fault

But don't listen to them haters tryna fill your ears with salt


All this revenue coming in, I'll probably never spend

I just bought my BM a Benz, now that's another Benz

I just cut off all of my friends and brought my brothers in

I don't see nobody but me, who I'm gon' lose to?

I can't move around without tools, these niggas loose screws

I can see me taking the lead over the new school

They remember me from selling weed at my old school

Only hit it once and now it's old news

Blew up, who the fuck would knew? Paint my Trackhawk Nipsey Blue

If I get one, you get one too, I really move how bosses move

I never call myself a G.O.A.T., I leave that love to the people

Everybody can't go to the top, I had to leave some people

I'ma be forever scheming, woke up, I thought I was dreaming

Watched my lil' boy play with toys, I just dropped a tear of joy

Some shit that I feel for

I been going crazy with that scoring, call me baby Harden

They say I'll be great, I guess I'm waiting for it",
878,Koe Wetzel,High Road,"
And I know, I know

Ima take the high road

Maybe get stoned

Have a little too much of something terrible

Ima let you cool down while I walk out

You ain't messin' me up like the times before

I don't need a ticket to your shit show

Knock yourself out and hit a new low

Ima take the high road

Take the high road

Take the high road


You don’t wanna talk about it boy that’s no surprise

You comе home smelling like liquor likе every other night

If I catch you with her, you gon’ catch me with him

You think I don’t hear about it, you better think again

You know that rumors always turn into yelling and fighting

And once it’s in my mind only one way I’m driving",
610,Lizzo,About Damn Time,"
Oh, I been so down and under pressure

I'm way too fine to be this stressed, yeah

Oh, I'm not the girl I was or used to be, uh

Bitch, I might be better


Turn up the music, turn down the lights

I got a feelin' I'm gon' be alright

Okay (Okay), alright

It's about damn time (Time)

Turn up the music, let's celebrate (Alright)

I got a feelin' I'm gon' be okay

Okay (Okay), alright

It's about damn time",
831,Marshmello,Miles on It,"
Girl, let's go put some miles on it

Back of the Chevy with the engine runnin'

Just you and me in a truck bed wide like a California King

We could break it in if you know what I mean

Put some miles on it

Back of the Chevy with the engine runnin'

Just you and me in a truck bed wide like a California King

Wе could break it in if you know what I mean

Put some milеs on it

We could break it in if you know what I mean


All night, no brakes

All tail, no gate

Ain't gotta try too hard

My baby's push to start

All torque, full speed

Off-road, on me

Zero to a hundred fast

My foot ain't touch the gas

I said, ""Hey, baby, slow it down, let's make it last""

You said, ""Where's the fun in that?""",
576,Mariah Carey,All I Want for Christmas Is You,"
I don't want a lot for Christmas 

There is just one thing I need 

I don't care about presents 

Underneath the Christmas tree 

I don't need to hang my stocking 

There upon the fireplace 

Santa Claus won't make me happy 

With a toy on Christmas day 

I just want you for my own 

More than you could ever know 

Make my wish come true 

All I want for Christmas is you... 

You baby 


I won't ask for much this Christmas 

I won't even wish for snow 

I'm just gonna keep on waiting 

Underneath the mistletoe 

I won't make a list and send it 

To the North Pole for Saint Nick 

I won't even stay awake to 

Hear those magic reindeer click 

'Cause I just want you here tonight 

Holding on to me so tight 

What more can I do 

Baby all I want for Christmas is you 

You... ",
311,Lizzo,Truth Hurts,"
Why men great 'til they gotta be great?

Don't text me, tell it straight to my face

Best friend sat me down in the salon chair

Shampoo press, get you out of my hair

Fresh photos with the bomb lighting

New man on the Minnesota Vikings

Truth hurts, needed something more exciting

Bom bom bi dom bi dum bum bay


You tried to break my heart?

Oh, that breaks my heart

That you thought you ever had it

No, you ain't from the start

Hey, I'm glad you're back with your bitch

I mean who would wanna hide this?

I will never, ever, ever, ever, ever be your side chick

I put the sing in single

Ain't worried 'bout a ring on my finger

So you can tell your friend, “shoot your shot” when you see 'em

It's OK, he already in my DMs",
24,Adele,Send My Love (To Your New Lover),"
I'm giving you up

I've forgiven it all

You set me free


Send my love to your new lover

Treat her better

We've gotta let go of all of our ghosts

We both know we ain't kids no more

Send my love to your new lover

Treat her better

We've gotta let go of all of our ghosts

We both know we ain't kids no more",
470,Young Thug,Hot,"
Cartier eye

I'm the bossman in a suit but no tie

I can't be sober, I gotta stay high

Pour me some syrup in a Canada Dry

Ridin' in the spaceship like Bonnie and Clyde

Don't worry, baby, I keep me some fire

Shenenehs and Birkins, she cannot decide

The latest Mercedes, it goes through surprise

Don't sleep on miss lady, her pussy a prize

Dick in her back while I'm grippin' her sides

Bigger Maybach, this ain't regular size

We really fly, we like pelican glide

Bitch, you ain't slick, I can tell the disguise

Upgraded my wrist, put baguettes in that Sky

She sing, I might sign her and change her whole life

I told her to gargle and work on her highs


Everything litty, I love when it's hot

Turned up the city, I broke off the notch

Got some more millis, I keep me a knot

I created history and made me a lot

He tried to diss me and ended on Fox

We call them chopsticks 'cause they gonna chop

Took her out of Follies 'cause her pussy pop

I run it like Nike, we got it on lock",
507,Lil Nas X,Montero (Call Me by Your Name),"
Cocaine and drinkin' with your friends

You live in the dark, boy, I cannot pretend

I'm not phased, only here to sin

If Eve ain't in your garden, you know that you can


Call me when you want, call me when you need

Call me in the morning, I'll be on the way

Call me when you want, call me when you need

Call me out by your name, I'll be on the way like",
790,Morgan Wallen,Ain't That Some,"
Ain't that some back home buddies in a field mud on the wheels

Yeah, ain't that some thick smoke Silverado tearin' up a two lane road

Ain't that some C-O-U-N-T-R-Y shit we been doin' since we was yea high

There's folks out there ain't T-R-Y'd this

Man, ain't that some shit

Ain't that some, ain't that some, ain't that some shit

Yeah


My true north is due south, with a blue Coors goin' down

Just like that setting sun on my old Z71

I know it's cliché to sing Chevrolets, cold beers and Fridays

But that's just the way it is out here",
122,Cardi B,Bodak Yellow,"
Now she say she gon' do what to who? Let's find out and see

Cardi B, you know where I'm at, you know where I be

You in the club just to party, I'm there, I get paid a fee

I be in and out them banks so much, I know they're tired of me

Honestly, don't give a fuck 'bout who ain't fond of me

Dropped two mixtapes in six months, what bitch working as hard as me?

I don't bother with these hoes, don't let these hoes bother me

They see pictures, they say, ""Goals,"" bitch, I'm who they tryna be

Look, I might just chill in some BAPE, I might just chill with your boo

I might just feel on your babe, my pussy feel like a lake

He wanna swim with his face, I'm like, ""Okay""

I'll let him get what he want, he buy me Yves Saint Laurent

And the new whip, when I go fast as a horse, I got the trunk in the front

I'm the hottest in the street, know you prolly heard of me

Got a bag and fixed my teeth, hope you hoes know it ain't cheap

And I pay my mama bills, I ain't got no time to chill

Think these hoes be mad at me, their baby father run a bill


Said, ""Lil bitch, you can't fuck with me if you wanted to""

These expensive, these is red bottoms, these is bloody shoes

Hit the store, I can get 'em both, I don't wanna choose

And I'm quick, cut a nigga off, so don't get comfortable, look

I don't dance now, I make money moves

Say I don't gotta dance, I make money move

If I see you and I don't speak, that means I don't fuck with you

I'm a boss, you a worker, bitch, I make bloody moves",
566,Drake,What's Next,"
Yeah, I got one, Virgil got one and that there is the only two

Man, how many times have I shown improvement?

How many nights I been, woah

Swervin' them potholes, not tryna fuck up the wheels on the road, okay

Funny how life goes

He thought he was sick, now he wipin' his nose, okay

Soon as you give 'em your soul

You blow up and they say you sellin' your soul, okay

Thеy want my life exposed, thеy wanna know about the highs and lows


Well summer, all I did was rest, okay?

And New Year's, all I did was stretch, okay?

And Valentine's Day, I had sex, okay?

We'll see what's 'bout to happen next

Okay? Okay? Okay?

We'll see what's 'bout to happen next

Okay? Okay? Okay?

We'll see what's 'bout to happen, ayy, ayy

We'll see what's 'bout to happen, ayy

We'll see what's 'bout to happen",
149,Imagine Dragons,Thunder,"
Thunder, thunder

Thunder, thun-, thunder

Thun-thun-thunder, thunder, thunder

Thunder, thun-, thunder

Thun-thun-thunder, thunder


Thunder, feel the thunder

Lightning and the thunder

Thunder, feel the thunder

Lightning and the thunder

Thunder, thunder

Thunder",
