song_id,artist,title,lyrics,emotion
481,Pop Smoke,Dior,"
She  like the way that I dance

She like the way that I move

She like the way that I rock

She like the way that I woo

And  she let it clap for a nigga

(She let it clap for a nigga)

And she throw it back for a nigga

(Yeah, she throw it back for a nigga)

Mike Amiri, Mike Amiri

Billie Jean, Billie Jean (Uh)

Christian Dior, Dior

I'm up in all the stores

When it rains, it pours

She like the way I rrr

Mike Amiri, Mike Amiri

Billie Jean, Billie Jean (Uh)

Christian Dior, Dior

I'm up in all the stores

When it rains, it pours

She like the way I rrr


When I walk in the spot, thirty on me

Buy out the club, niggas know that I'm paid

Bitch, I'm a thot, get me lit

I can't fuck with these niggas 'cause niggas is gay

All on my page suckin' dick

All in my comments and screamin' my name

While I'm in the club, throwin' them hundreds and fifties and ones and ones

Pop Smoke, they know I'm wildin'

If I'm on the island, I'm snatchin' the cell

Brody got locked, denied his bail

Until he free, I'm raisin' hell

Tell my shooters call me FaceTime

For all the times we had to face time

Free D-Nice, he doin' state time

If you need the glizzy, you could take mine

Please don't come out your mouth, you know I'm like that

I'll make a movie like TNT

Glock-30 on me, ask who really want it

I bet I air it like BNB

Nappy Blue wildin' in my section

And I keep that .38 for the weapon

Remember when I came home from corrections

All the bad bitches in my direction",Happiness
398,Juice Wrld,Robbery,"
I can't reverse it

It was a gift and a curse

And now I'm drinking too much, so I'ma talk with a slur

Last time I saw you it ended in a blur

I woke up in a hearse

She said, ""You loved me first"" (First)

One thing my dad told me was, ""Never let your woman know when you're insecure""

So I put Gucci on the fur

And I put my wrist on iceberg

One thing my heart tells me is, ""Flex on a ho every time they're insecure""

Ou-ou-ouh

I'm running from you-ou-ou

Is your love for real? (For real? For real?)

Is your love really true?


She told me put my heart in the bag (In the bag)

And nobody gets hurt (Nobody)

Now I'm running from her love, I'm not fast (Fast)

So I'm making it worse (Making it worse)

Now I'm digging up a grave, from my past

I'm a whole different person (A whole different person)

It's a gift and a curse (A gift and a curse)

But I cannot reverse it",Sadness
117,Rae Sremmurd,Black Beatles,"
Getting so gone I'm not blinkin'

What in the world was I thinkin'?

New day, new money to be made

There is nothin' to explain

I'm a fuckin' black Beatle, cream seats in the Regal

Rockin' John Lennon lenses, like to see em spread eagle

Took a bitch to the club and let her party on the table

Screamin', ""Everybody's famous!""

Like clockwork, I blow it all

And get some more

Get you somebody that can do both

Black Beatles got the babes belly rollin'

She think she love me, I think she trollin'


That girl is a real crowd pleaser

Small world, all her friends know of me

Young bull livin' like an old geezer

Quick release the cash, watch it fall slowly

Frat girls still tryna get even

Haters mad for whatever reason

Smoke in the air, binge drinkin'

They lose it when the DJ drops the needle",Happiness
603,Ed Sheeran,Shivers,"
I wanna be that guy

I wanna kiss your eyes

I wanna drink that smile

I wanna feel like I'm

Like my soul's on fire

I wanna stay up all day and all night, mm

Yeah, you got me singing like


Ooh, I love it when you do it like that

And when you're close up, give me thе shivers

Oh, baby, you wanna dance 'til the sunlight cracks

And whеn they say the party's over then we bring it right back

And we say, ooh, I love it when you do it like that

And when you're close up, give me the shivers

Oh, baby you wanna dance 'til the sunlight cracks

And when they say the party's over then we bring it right back",Happiness
135,Drake,Fake Love,"
Somethin' ain't right when we talkin'

Somethin' ain't right when we talkin'

Look like you hidin' your problems

Really you never was all in

No you can't son me, you won't never get to run me

Just when shit look, outta reach, I reach back like one, three

Like one, three, yeah


That's when they smile in my face

Whole time they wanna take my place

Whole time they wanna take my place

Whole time they wanna take my place

Yeah, I know they wanna take my place

I can tell that love is fake

I don't trust a word you say

How you wanna click up after your mistakes?

Look you in the face and it's just not the same",Disgust
605,Latto,Big Energy,"
Tell me how you want it (Huh?)

Three, two, one and I'm on it (On it)

Feel good, don't it? (Don't it?)

Hood bitch, fuck you bonnet (Yeah)

I'ma bust it down the pole like onyx (Ooh)

Want you bein' honest (Uh-huh)

Pussy juicy, Minute Maid (Oh)

But can't do it onе minute, man (Hell no)

Not a side hoе, a main

I'm the only bitch he entertain (Yeah)

Spendin' his mind in the bank (In the bank)

I like what I see (Yeah)

A boss like you need a boss like me (Uh-huh)

Daddy from the street, so he move lowkey

Tryna ride that mic' like karaoke (Oh)


On the count of three, bad bitches, get money (Money)

Broke niggas to the left, we don't want it (We don't want)

I'm the one these bitches hate but they can't get past (Uh-huh)

Pretty face, no waist and a big ol' ass, ha",Happiness
346,Juice Wrld,Lucid Dreams,"
You left me falling and landing inside my grave

I know that you want me dead (cough)

I take prescriptions to make me feel a-okay

I know it's all in my head


I have these lucid dreams where I can't move a thing

Thinking of you in my bed

You were my everything

Thoughts of a wedding ring

Now I'm just better off dead (coughs)

I'll do it over again

I didn't want it to end

I watch it blow in the wind

I should've listened to my friends

Did this shit in the past

But I want it to last

You were made outta plastic (fake)

I was tangled up in your drastic ways

Who knew evil girls have the prettiest face

You gave me a heart that was full of mistakes

I gave you my heart and you made heart break",Sadness
729,Gunna,FukUMean,"
Ha, ha, ha, ha

Ha, ha, ha, ha


Fuck you mean?

Young Gunna Wunna, they workin' my nerves

I'm about to pour up some syrup

Fucking this bitch like a perv'

Smack from the back, grab her perm

Ice, the burr, uh, shittin' on all you lil' turds

Can't take that dick, wait your turn

In my own lane, we can't merge

Suck with no hands, you can learn

Let's see how much you can earn

Watch me go big like thе Worm

And I ain't smokin' no sherm

I'm in this bitch with P Litty

QP, QP-ski

All of my bitches is pretty, thеy showin' they titties, it's up to the ceilin'

I let her run through a million, I rock with her really, let's fuck on a billion

I'ma get down to the gritty, then fuck up the city, the home of the villains

Ecstasy, wonderful feelin'

Smoke out the pound when I'm chillin'

Trappin', I made me a killin'

Look, I got everybody wishin'

I hope you play your position

I don't want nobody listenin'

I see the ho with precision

Get rich my only decision",Happiness
822,Sabrina Carpenter,Feather,"
I slam the door

I hit ""Ignore""

I say, ""No, no, no, no more.""

I got you blocked after this an after thought

I finally cut you off


I feel so much lighter, like a feather with you off my mind

Floating through the memories, like whatever, you're a waste of time

Your signals are mixed

You act like a bitch

You fit every stereotype, send the pic

I feel so much lighter, like a feather with you out my life

With you off my mind",Anger
696,Sam Smith,Unholy,"
Lucky, lucky girl, she got married to a boy like you

She'd kick you out if she ever, ever knew

'Bout all the **** you tell me that you do

Dirty, dirty boy, you know everyone is talking on the scene

I hear them whisperin' 'bout the places that you been

And how you don't know how to keep your business clean


Mummy don't know daddy's getting hot

At the body shop

Doing somethin' unholy

He's sat back while she's droppin' it

She'd be poppin' it

Yeah, she put it down slowly

Oh, eh, oh, eh, oh, he left his kids at home

Eh, oh, eh, oh, so he can get that-

Mummy don't know daddy's getting hot

At the body shop (Hehe)

Doing somethin' unholy (Woo)",Fear
95,Future,Wicked,"
Candles burning, money burning, graveyard these niggas

Phantom parkin', big dawg barkin' hey

Blood tales on me, oh-oh-oh-oh

Shawty want that wig, oh-oh-oh-oh

I'm drippin' Cartier, oh-oh-oh-oh

Put a gold bird on you, that's what's happening

I put that lingo on her, she was Spanish

I fill a one liter up with Xannies

This continental and it's panoramic

It's complimentary to the savages

You fuck around with me, it be a tragedy

I want green, green, green, all asparagus

I drink lean, lean, lean it ain't embarassing


Wicked, wicked, wicked, wicked, wicked

Hold up, wicked, wicked, wicked, wicked

Woah, wicked, wicked, wicked, wicked, wicked",
753,Mariah Carey,All I Want for Christmas Is You,"
I don't want a lot for Christmas 

There is just one thing I need 

I don't care about presents 

Underneath the Christmas tree 

I don't need to hang my stocking 

There upon the fireplace 

Santa Claus won't make me happy 

With a toy on Christmas day 

I just want you for my own 

More than you could ever know 

Make my wish come true 

All I want for Christmas is you... 

You baby 


I won't ask for much this Christmas 

I won't even wish for snow 

I'm just gonna keep on waiting 

Underneath the mistletoe 

I won't make a list and send it 

To the North Pole for Saint Nick 

I won't even stay awake to 

Hear those magic reindeer click 

'Cause I just want you here tonight 

Holding on to me so tight 

What more can I do 

Baby all I want for Christmas is you 

You... ",
580,Duncan Laurence,Arcade,"
I spent all of the love I've saved

We were always a losing game

Small-town boy in a big arcade

I got addicted to a losing game


Ooh, ooh

All I know, all I know

Loving you is a losing game",
882,Gunna,FukUMean,"
Ha, ha, ha, ha

Ha, ha, ha, ha


Fuck you mean?

Young Gunna Wunna, they workin' my nerves

I'm about to pour up some syrup

Fucking this bitch like a perv'

Smack from the back, grab her perm

Ice, the burr, uh, shittin' on all you lil' turds

Can't take that dick, wait your turn

In my own lane, we can't merge

Suck with no hands, you can learn

Let's see how much you can earn

Watch me go big like thе Worm

And I ain't smokin' no sherm

I'm in this bitch with P Litty

QP, QP-ski

All of my bitches is pretty, thеy showin' they titties, it's up to the ceilin'

I let her run through a million, I rock with her really, let's fuck on a billion

I'ma get down to the gritty, then fuck up the city, the home of the villains

Ecstasy, wonderful feelin'

Smoke out the pound when I'm chillin'

Trappin', I made me a killin'

Look, I got everybody wishin'

I hope you play your position

I don't want nobody listenin'

I see the ho with precision

Get rich my only decision",
817,SZA,Saturn,"
Stuck in this paradigm

Don't believe in paradise

This must be what Hell is like

There's got to be more, got to be more

Sick of this head of mine

Intrusive thoughts, they paralyzе

Nirvana's not as advertised

Therе's got to be more, been here before


Ooh (Ooh, ooh)

Life's better on Saturn

Got to break this pattern

Of floating away

Ooh (Ooh, ooh)

Find something worth saving

It's all for the taking

I always say",
673,Lauren Spencer-Smith,Fingers Crossed,"
Now I remember when you'd call me late at night

I gave you my hours and advice just tryna fix you

And all your daddy issues

But now I don't even miss you anymore


So I, I want all the tears back that I cried

All the hours spent giving advice

On how to write your songs

All you did was prove me wrong

When you said you loved me

Well, you must've had your fingers crossed",
785,Old Dominion,Memory Lane,"
Thinkin' 'bout those sunsets that bled into jean jacket nights

Those tangled up mornings lost in paradise

Still drunk on the feeling when I close my eyes

You're pulling me closer, your head on my shoulder

We'd never let go and we'd never be over


If I could buy a house on Memory Lane

I wouldn't have to wonder if you miss me the same

I'd be loving you as usual, telling you you're beautiful

Oh, I'd be happily delusional",
654,Nicki Minaj,Super Freaky Girl,"
One thing about me, I'm the baddest alive

He know the prettiest bitch didn't come until I arrive

I don't let bitches get to me, I fuck they man if they try

I got a princess face, a killer body, samurai mind

They can't be Nicki, they so stupid, I just laugh when they try

A thong bikini up my ass, I think I'll go for a dive

His ex bitch went up against me, but she didn't survive

On applications I write, ""Pressure"", 'cause that's what I apply (Brrrr)

Pressure applied, can't fuck a regular guy

Wetter than umbrellas and stickier than Apple Pie


I can lick it, I can ride it

While you slippin' and slidin'

I can do all them little tricks and keep the dick up inside it

You can smack it, you can grip it

You can go down and kiss it

And every time he leave me 'lone, he always tell me he miss it

He want a F-R-EEEEE-A-K

F-R-EEEEE-A-K, A-K, A-K, A-K

EEEEE-A-K

F-R-EEEEE-A-K",
45,DJ Snake,Let Me Love You,"
Say go through the darkest of days

Heaven's a heartbreak away

Never let you go, never let me down

Oh it's been a hell of a ride

Driving the edge of a knife

Never let you go, never let me down


Don't you give up, nah, nah, nah

I won't give up, nah, nah, nah

Let me love you

Let me love you

Don't you give up, nah, nah, nah

I won't give up, nah, nah, nah

Let me love you

Let me love you

Oh baby, baby",
286,XXXTentacion,Moonlight,"Yeah
Spotlight, uh, moonlight, uh
Nigga, why you trippin'? Get your mood right, uh
Shawty look good in the moonlight
All these pussy niggas so bad mind
Spotlight, moonlight

Nigga, why you trippin'? Get your mood right

Shawty look good in the moonlight

All these pussy niggas so bad mind

Spotlight, uh, moonlight

Nigga, why you trippin'? Get your mood right, uh

Shawty look good in the moonlight

All these pussy niggas so bad mind

Spotlight, moonlight

Nigga, why you trippin'? Get your mood right

Shawty look good in the moonlight

All these pussy niggas so bad mind

Feel like I'm destined

I don't need no Smith & Wesson, no

Girl, who you testin'?

Fuck a Scantron, here's your lesson, oh

Knife in intestine

Takin' shots with all your brethren, no

Feel like I'm damaged

Feelin' like you fuckin' planned it

All alone, call my phone, make me feel right

Girl you know when you call, make me feel right

All alone, call my phone, make me feel right

Girl you know when you call, make me feel right

Spotlight, uh, moonlight, uh

Nigga, why you trippin'? Get your mood right, uh

Shawty look good in the moonlight

All these pussy niggas so bad mind

Spotlight, moonlight

Nigga, why you trippin'? Get your mood right

Shawty look good in the moonlight

All these pussy niggas so bad mind

Spotlight, uh, moonlight

Nigga, why you trippin'? Get your mood right, uh

Shawty look good in the moonlight

All these pussy niggas so bad mind

Spotlight, moonlight

Nigga, why you trippin'? Get your mood right

Shawty look good in the moonlight

All these pussy niggas so bad mind",
541,Doja Cat,You Right,"
And you're right

You right, I got my guy

But I, I can't help it, I want you

Said, you right, I got my guy

But I, I can't help it, I want you


I can't stop and look the other way

'Cause I know it could be, babe, and you never feel the same

You'd be thinkin' 'bout it every day

Don't believe in fairytales, but we got our fantasies

And it's me and you, no she

Tryna be all through your sheets

Have you all on top of me

Actin' like it's not that deep

Boy, you can take it off of me

Tell me what it's 'bout to be

Really feel it's bound to bе

I can't tell no one, but they all know",
828,Morgan Wallen,Thinkin' Bout Me,"
When you're tasting what he's drinking, are you thinkin' 'bout me?

When you're ridin' where he's drivin', are you missing my street?

Every time you close your eyes, tell me, who do you see?

When you're tasting what he's drinking, are you thinkin' 'bout me?

Comin' over tonight, wish that truck in your driveway was mine

It's like you know it's supposed to be

When you're up in his bed, am I up in your head?

Makin' you crazy, tell me, baby, are you thinkin' 'bout me?

Are you thinkin' 'bout, are you thinkin' 'bout

When you're tasting what he's drinking, are you thinkin' 'bout me?


Do you hide your phone? Did you change my name?

When he wants to go to our go-to place

Do you tell him you came then go out of your way

To be somewhere, any damn where I ain't",
210,Juice Wrld,Lucid Dreams,"
You left me falling and landing inside my grave

I know that you want me dead (cough)

I take prescriptions to make me feel a-okay

I know it's all in my head


I have these lucid dreams where I can't move a thing

Thinking of you in my bed

You were my everything

Thoughts of a wedding ring

Now I'm just better off dead (coughs)

I'll do it over again

I didn't want it to end

I watch it blow in the wind

I should've listened to my friends

Did this shit in the past

But I want it to last

You were made outta plastic (fake)

I was tangled up in your drastic ways

Who knew evil girls have the prettiest face

You gave me a heart that was full of mistakes

I gave you my heart and you made heart break",
547,Kali Uchis,Telepatía,"
You know I'm just a flight away

If you wanted you can take a private plane

A kilómetros estamos conectando

Y me prendes aunque no me estés tocando

You know I got a lot to say

All these voices in the background of my brain

Y me dicen todo lo que estás pensando

Me imagino lo que ya estás maquinando


Quién lo diría

Que se podría

Hacer el amor por telepatía

La luna está llena, mi cama vacía

Lo que yo te haría

Si te tuviera de frente la mente te la volaría

De noche y de día, de noche y de día",
591,Ritt Momney,Put Your Records On,"Three little birds sat on my window
And they told me I don't need to worry
Summer came like cinnamon, so sweet
Little girls double-dutch on the concrete
Maybe sometimes we got it wrong, but it's all right
The more things seem to change, the more they stay the same

Don't you hesitate

Girl, put your records on, tell me your favorite song

You go ahead, let your hair down

Sapphire and faded jeans

I hope you get your dreams

Just go ahead, let your hair down

You're gonna find yourself somewhere, somehow

Blue as the sky, sunburnt and lonely

Sipping tea in the bar by the road side (Just relax, just relax)

Don't you let those other boys fool you

Gotta love that Afro hairdo

Maybe sometimes we feel afraid, but it's all right

The more you stay the same, the more that they seem to change

Don't you think it's strange?

Girl, put your records on, tell me your favorite song

You go ahead, let your hair down

Sapphire and faded jeans

I hope you get your dreams

Just go ahead, let your hair down

You're gonna find yourself somewhere, somehow

Just more than I could take

Pity for pity's sake

Some nights kept me awake

I thought that I was stronger

When you gonna realize that you don't even have to try any longer?

Do what you want to

Girl, put your records on, tell me your favorite song

Just go ahead, let your hair down

Sapphire and faded jeans

I hope you get your dreams

Just go ahead, let your hair down

You're gonna find yourself someday, somehow",
612,Lil Nas X,Thats What I Want,"
These days I'm way too lonely

I'm missin' out, I know

These days I'm way too alone

And I'm known for giving love away but


I want someone to love me

I need somеone who needs me

'Cause it don't feel right whеn it's late at night

And it's just me in my dreams

So I want someone to love

That's what I fuckin' want",
473,YNW Melly,Suicidal,"
Your love is suicidal

For me, your love is suicidal

To me, your love is suicidal

To me, your love is suicidal


I'm sippin' Hennessy-'y-'y, ooh

I'm sippin' Hennessy-'y-'y, ooh",
861,Jelly Roll,Need a Favor,"
I know Amazing Grace, but I ain't been livin' them words

Swear I spend most Sundays, drunk off my ass, than I have in church

Hard cover King James only been savin' dust on the nightstand

And I don't know what to say by the time I fold my hands


I only talk to God when I need a favor

And I only pray when I ain't got a prayer

So, who the hell am I, who the hell am I

To expect a Savior o-o-oh

If I only talk to God when I need a favor

God I need a favor

Amen. Amen.",
219,Bazzi,Mine,"
Hands on your body, I don't wanna waste no time

Feels like forever even if forever's tonight

Just lay with me, waste this night away with me

You're mine, I can't look away, I just gotta say


I'm so fucking happy you're alive

Swear to God I'm down if you're down all you gotta say is right

Girl anything I can do just to make you feel alright

Oh, oh, oh, oh, I just had to let you know you're fine

Running circles 'round my mind

Even when it's rainy all you ever do is shine

You on fire, you a star just like Mariah

Man this feel incredible, I'll turn you into a bride, you're mine",
709,Sam Smith,Unholy,"
Lucky, lucky girl, she got married to a boy like you

She'd kick you out if she ever, ever knew

'Bout all the **** you tell me that you do

Dirty, dirty boy, you know everyone is talking on the scene

I hear them whisperin' 'bout the places that you been

And how you don't know how to keep your business clean


Mummy don't know daddy's getting hot

At the body shop

Doing somethin' unholy

He's sat back while she's droppin' it

She'd be poppin' it

Yeah, she put it down slowly

Oh, eh, oh, eh, oh, he left his kids at home

Eh, oh, eh, oh, so he can get that-

Mummy don't know daddy's getting hot

At the body shop (Hehe)

Doing somethin' unholy (Woo)",
682,Future,Puffin on Zootiez,"
Dirty the Fanta but make it in Canada

Bro get this money like it's my religion

It's gon' be a mad day, a sad day for any of these niggas

That try to compare whatever I did

Damn near touched a hundred, it just off the gig

I came out the jungle, they kidnapped a kid

I trap out a bando, spent ten on a crib

I look at the ocean to spot thirty M's

Pin it where I'm at, the city I'm in

I give you my fully, no matter where I'm in

Her hair touch her ass, she gon' think she Korean

You fuckin' me good, bitch, you helpin' me win

Niggas can't see me, ain't no competition

Too many bracelets, need a whole 'nother wrist

I'm never sober, I think I'ma quit

I pop the E, I can feel when it kick


She bought a flight, nigga, can't even see me

I'm way outta here, I'm too far in the sky

Hermès ashtray to dump my ashes

Bitch so pretty, look better than Cassie

Puffiin' on zooties and she callin' me daddy

Walkin' on shit, turn it up and not gas it

Came out the gutter, it ain't nothin' for me to swag it

Secure the bag, got a bitch, I'ma bag it

Turnin' it up, gotta make sure shit good

Park it, two mil' in the middle of my hood

Drinkin' on mud, I made it out of the sewer

Chrome Heart accessories, whatever, I'm good

Lot of these niggas, they lookin' the same

They copy my lingo, they bitin' my chain

Championship, championship, Range just gon' amp this shit

Bitch break her neck just to look at the kid",
650,Joji,Glimpse of Us,"
When you're out of sight

In my mind


'Cause sometimes I look in her eyes

And that's where I find a glimpse of us

And I try to fall for her touch

But I'm thinkin' of the way it was

Said I'm fine and said I moved on

I'm only here passing time in her arms

Hopin' I'll find a glimpse of us",
37,Alessia Cara,Here,"
Oh-oh-oh here, oh-oh-oh here

Oh-oh-oh I asked myself, what am I doin' here?

Oh-oh-oh here, oh-oh-oh here

And I can't wait 'til we can break up out of here


Excuse me if I seem a little unimpressed with this

I ain't a social pessimist, but usually I don't mess with this

And I know you mean only the best 

And your intentions aren't to bother me

But honestly I'd rather be

Somewhere with my people

We can kick it and just listen to

Some music with a message, like we usually do

And we'll discuss our big dreams

How we plan to take over the planet

So pardon my manners

I hope you'll understand that I'll be here

Not there in the kitchen

With the girl who's always gossiping about her friends

So tell them I'll be here

Right next to the boy who's throwin' up

'Cause he can't take what's in his cup no more

Oh God why am I here?",
267,Imagine Dragons,Natural,"
That's the price you pay

Leave behind your heart and cast away

Just another product of today

Rather be the hunter than the prey

And you're standing on the edge, face up 'cause you're a...


Natural

A beating heart of stone

You gotta be so cold

To make it in this world

Yeah, you're a natural

Living your life cutthroat

You gotta be so cold

Yeah, you're a natural",
358,Lauren Daigle,You Say,"
The only thing that matters now is everything You think of me

In You I find my worth, in You I find my identity, o-ooh


You say I am loved when I can’t feel a thing

You say I am strong when I think I am weak

You say I am held when I am falling short

When I don’t belong, oh you say I am yours

And I believe, oh I believe

What You say of me

Oh, I believe",
653,CKay,Love Nwantiti (Ah Ah Ah),"
(Unle) Your body dey baka mi si (Unle)

Open am make I see (Unle)

Gimme love nwantiti

Baby make a bad man sing oh yeah


Ah-ah-ah-ah-ah-ah

Ah-ah-ah-ah-ah-ah-ah-ah

Ah-ah-ah-ah-ah-ah

Ah-ah-ah-ah-ah-ah-ah-ah

Ah-ah-ah-ah-ah-ah

Ah-ah-ah-ah-ah-ah-ah-ah

Ah-ah-ah-ah-ah-ah

Ah-ah-ah-ah-ah-ah-ah-ah",
