song_id,artist,title,lyrics,emotion
332,Drake,Money in the Grave,"
When I die, put my money in the grave

I really gotta put a couple niggas in they place

Really just lapped every nigga in the race

I really might tat ""Realest Nigga"" on my face

Lil CC let it slap with the bass

I used to save hoes with a mask and a cape

Now I'm like, ""Nah, love, I'm good, go away""

Ain't about to die with no money, I done gave it


I was on top when that shit meant a lot

Still on top like I'm scared of the drop

Still on top and these niggas wanna swap

Niggas wanna swap like it's Slauson or Watts

I don't wanna change 'cause I'm good where I'm at

Mob ties, so I'm always good where I'm at

Word to Junior, Jazzy, Baby J

Tell 'em when I die, put my money in the grave",
533,Justin Bieber,Holy,"
I don't do well with the drama

And, no, I can't stand it being fake

(No, no, no, no, no, no, no)

I don't believe in nirvana

But the way that we love in the night gave me life

Baby, I can't explain


That the way you hold me, hold me, hold me, hold me, hold me

Feels so holy, holy, holy, holy, holy

On God

Runnin' to the altar like a track star

Can't wait another second

'Cause the way you hold me, hold me, hold me, hold me, hold me

Feels so holy",
