song_id,artist,title,lyrics,emotion
832,Taylor Swift,I Can Do It with a Broken Heart,"
'Cause I'm a real tough kid

I can handle my shit

They said, ""Babe, you gotta fake it 'til you make it""

And I did

Lights, camera, bitch, smile

Even when you want to die

He said he'd love me all his life

But that life was too short

Breaking down, I hit the floor

All the pieces of me shattered

As the crowd was chanting ""More!""

I was grinning like I'm winning

I was hitting my marks

'Cause I can do it with a broken heart


I'm so depressed, I act like it's my birthday

Every day

I'm so obsessed with him, but he avoids me

Like the plague

I cry a lot, but I am so productive

It's an art

You know you're good when you can even do it with a broken heart",
