song_id,artist,title,lyrics,emotion
81,Adele,When We Were Young,"
But if by chance you're here alone

Can I have a moment

Before I go?

'Cause I've been by myself all night long

Hoping you're someone I used to know


You look like a movie

You sound like a song

My God, this reminds me

Of when we were young",
429,Lizzo,Good as Hell,"
Woo child, tired of the bullshit

Go on dust your shoulders off, keep it moving

Yes Lord, tryna get some new shit

In there, swimwear, going to the pool shit

Come now, come dry your eyes

You know you a star, you can touch the sky

I know that it's hard but you have to try

If you need advice, let me simplify


If he don't love you anymore

Just walk your fine ass out the door",
257,Cardi B,Be Careful,"
The only man, baby, I adore

I gave you everything, what's mine is yours

I want you to live your life of course

But I hope you get what you dyin' for

Be careful with me, do you know what you doin'?

Whose feelings that you're hurtin' and bruisin'?

You gon' gain the whole world

But is it worth the girl that you're losin'?

Be careful with me

Yeah, it's not a threat, it's a warnin'

Be careful with me

Yeah, my heart is like a package with a fragile label on it

Be careful with me


Care for me, care for me

Always said that you'd be there for me, there for me

Boy, you better treat me carefully, carefully, look",
254,6ix9ine,Gummo,"
I'm on some rob a nigga shit, take a nigga bitch

Do the dash in the whip, count the cash in the whip

I pull up with a stick, I let that shit hit

Shout out... but I fucked that nigga bitch


Niggas iffy, uh, Blicky got the stiffy, uh

Got the blicky, uh, drum it holds fifty, uh

Move milli, all my niggas on fifty, uh

Talk down, pew pew pew, you silly, uh

Hit a stain, fifty bands, all hunnids

Spinning through ya block like a pop shove it

Shoot at me I'm shooting back, I'm getting buckets

I ain't wanna take his life but nigga, fuck it",
813,Billie Eilish,Birds of a Feather,"
Birds of a feather, we should stick together

I know I said I'd never think I wasn't better alone

Can't change the weather, might not be forever

But if it's forever, it's even better


And I don't know what I'm crying for

I don't think I could love you more

It might not be long, but, baby, I",
513,Ed Sheeran,Bad Habits,"
My bad habits lead to late nights, endin' alone

Conversations with a stranger I barely know

Swearin' this will be the last but it probably won't

I got nothin' left to lose, or use, or do

My bad habits lead to wide eyes stare into space

And I know I'll lose control of the things that I say

Yeah, I was lookin' for a way out, now I can't escape

Nothin' happens aftеr two, it's true, it's true

My bad habits lead to you


Ooh-ooh, ooh-ooh

My bad habits lеad to you

Ooh-ooh, ooh-ooh

My bad habits lead to you",
625,Morgan Wallen,You Proof,"
I need something ""You proof""

Something stronger than I'm used to

Yeah, I've been pullin' 90 to 100

Feel like nothing's gonna cut it, that's the hard truth

Yeah, I need something ""You proof""

Aw, I need something ""You proof""


Poured 'em up 'til they're shutting 'em down, yeah

You never ain't not around, yeah

Don't matter what time or town, I can't get you gone

Turned the bar, yeah, upside down

Just lookin' for somethin' that does it

I'd give up all my money",
94,Tim McGraw,Humble and Kind,"
Hold the door say please say thank you

Don't steal, don't cheat, and don't lie

I know you got mountains to climb but

Always stay humble and kind

When the dreams you're dreamin' come to you

When the work you put in is realized

Let yourself feel the pride but

Always stay humble and kind


Don't expect a free ride from no one

Don't hold a grudge or a chip and here's why

Bitterness keeps you from flying

Always stay humble and kind

Know the difference between sleeping with someone

And sleeping with someone you love

I love you ain't no pick up line so

Always stay humble and kind",
745,Jordan Davis,Next Thing You Know,"
That she ain't movin' in

Next thing you know

There's a U-Haul trailer

Next thing you know

Your old apartment

Is y'all's new place

There goes the carpet

But the deer head stays


Next thing you know

You're savin' money like never before, just to

Spend it all at a jewelry store, gettin'

Down on one knee on her mama's porch

Just prayin' she don't say no

Next thing you know

Your best man gives a half-drunk speech and you're

Sunburnt on a honeymoon beach and you're

Left hand's gettin' used to that ring

And there the next two or three years go

Next thing you know",
851,Mariah Carey,All I Want for Christmas Is You,"
I don't want a lot for Christmas 

There is just one thing I need 

I don't care about presents 

Underneath the Christmas tree 

I don't need to hang my stocking 

There upon the fireplace 

Santa Claus won't make me happy 

With a toy on Christmas day 

I just want you for my own 

More than you could ever know 

Make my wish come true 

All I want for Christmas is you... 

You baby 


I won't ask for much this Christmas 

I won't even wish for snow 

I'm just gonna keep on waiting 

Underneath the mistletoe 

I won't make a list and send it 

To the North Pole for Saint Nick 

I won't even stay awake to 

Hear those magic reindeer click 

'Cause I just want you here tonight 

Holding on to me so tight 

What more can I do 

Baby all I want for Christmas is you 

You... ",
411,Jack Harlow,Whats Poppin,"
I could put the ball in the end zone, put a bad bitch in the friendzone, ooh

This shit sound like an intro, Jetson, give me that tempo, ooh

Told Pooh he a fool with this shit (He a fool)

Told her don't let her friends know (Don't)

In the 'Ville and I move like a don (Don)

Eating fettuccine at Vincenzo's

Me and my 'migos got that free smoke

On the West Coast, yeah, I'm talking 'bout pre-rolls (Pre-roll)

Dark haired bitch and she look like Shego (She do)

Hometown hero, feeling myself, can't murder my ego (Can't do it)

She heard of my deep stroke

She said, ""Babe, does it hurt when I deep throat?"" (It does)

Certified freak ho

Hang around us and she learnin' my lingo

Back then, wasn't worried 'bout me though

In the gym tryna work on my free throw

Goddamn

Spending money at the club like Sam's (Cha-ching)

Yes, ma'am

She a lil' freak on cam

But she don't put this on the 'Gram (Nah)

Lil' boys tryna diss on the 'Gram (Ayy)

I can't switch on the fam (Bitch)

Shit's hot, hit the switch on the fan (Hit that shit)

This where my head is (Listen)

I feel resentment from every direction

Even some homies be wearing expressions

I be discouraged from sharing my blessings (Damn)

We used to share a connection

Now it just feels like it's wearing and stretching

I'm getting real sick of taking advice

From people that never could stare at reflections (Ooh)

Somewhere in there is a lesson

Y'all ain't evolvin', it's very depressing

I'm at the club with the basketball team

Me and the Cardinals are sharing a section (Facts)

Gotta cherish the present

I'm drinking water and wearing protection

Got a career and I'm very invested

Some people call it a scary obsession (Ooh, period, but)

I like to call it a passion, I can't be sitting relaxin' (Nah, I can't)

PG, we getting some traction, I'm at the venue, it's packed in (Packed out)

I'm digging her accent

I got a B.B. Simon belt on me and she tryna get it unfastened

That's my type of distraction, that's my type and she Latin (That's facts, ooh)

Got my own flow and I'm 'bout to get a patent

Brand new sheets for the bed, they satin (Soft, real soft)

Y'all wasn't tuned in back then (Nah)

My swag, they keep jackin' (Keep on jackin')

I ain't doin' no verse, quit askin' (Quit askin')


What's poppin'? (Pooh, you a fool for this one)

Brand new whip just hopped in (Just hopped in)

I got options

I could pass that bitch like Stockton (It ain't nothin')

Just joshin'

I'ma spend this holiday locked in (Ooh)

My body got rid of them toxins (Mmh, mmh)

SportsCenter, top ten",
148,J Balvin,Mi Gente,"
Toda mi gente se mueve

Mira el ritmo como los tiene

Hago música que entretiene

Mi música los tiene fuerte bailando

Y se baila así


Estamos rompiendo la discoteca

La fiesta no para, apenas comienza

Se come-ci, si comme-ça

Ma chèrie, la la la la la

Francia, Colombia

Me gusta (Freeze)

J Balvin, Willy William

Me gusta (Freeze)

Los DJ's no mienten, le gusta a mi gente

Y eso se fue mundial (Freeze)

No le bajamos, más nunca paramos

Es otro palo y ¡Blam!",
748,Stephen Sanchez,Until I Found You,"
Georgia, pulled me in, I asked to...

Love her, once again

You fell, I caught you

I'll never let you go again, like I did

Oh, I used to say


""I would never fall in love again, until I found her""

I said, ""I would never fall, unless it's you I fall into""

I was lost within the darkness, but then I found her

I found you",
256,Maroon 5,Wait,"
Wait, can you turn around, can you turn around? Just wait

Can we work this out, can we work this out? Just wait

Can you call me please? 'Cause I wanna be with you


Wait, can you turn around, can you turn around? Just wait

Can we work this out, can we work this out? Just wait

Can you call me please? 'Cause I wanna be with you",
466,Lee Brice,One of Them Girls,"
And you're one of them girls that ain't tryna meet nobody

You're just here for the party, if I'm wrong then stop me, yeah

You're one of them girls that ain't handin' out your number

You like to make us want you, you like to make us wonder


If you're one of them girls, 'cause I'm one of them boys

Would trade his whole world, hm, yeah

For one of them girls who likes to act all quiet, sexy, not even tryin'

Yeah, you know I ain't lyin', damn right

You one of them girls, broke every heart in your hometown

On the day you rode out, got 'em all wishin' on stars now",
436,BTS,Dynamite,"
This is getting heavy

Can you hear the bass boom? I'm ready

Life is sweet as honey

Yeah, this beat cha-ching like money

Disco overload, I'm into that, I'm good to go

I'm diamond, you know I glow up

Hey, so let's go


'Cause I, I, I'm in the stars tonight

So watch me bring the fire and set the night alight (Hey)

Shining through the city with a little funk and soul

So I'ma light it up like dynamite, woah",
532,Maroon 5,Beautiful Mistakes,"
Now I'm not holding on, not holding on

I'm just depressed that you're gone

Not holding on, not holding on


Beautiful mistakes

I make inside my head, she's naked in my bed

And now we lie awake, makin' beautiful mistakes

I wouldn't take 'еm back, I'm in love with the past

And now we liе awake, makin' beautiful mistakes",
756,Lainey Wilson,Heart Like a Truck,"
I got a heart like a truck

It's been drug through the mud

Runs on dreams and gasoline

And that old highway holds the key

It's got a lead foot down when it's leavin'

Lord knows it's taken a hell of a beatin'

A little bit of love is all that it's needin'

But it's good as it is tough

I got a heart like a truck


There ain't no brakin' when I throw it in drive

Don't always keep it in-between the lines

If you're a ready for a ridе

Pedal down state of mind

Boy, I tell you what

You bеtter buckle up",
782,Wham!,Last Christmas,"
[CHORUS:]


Once bitten and twice shy

I keep my distance

But you still catch my eye

Tell me baby

Do you recognize me?

Well

It's been a year

It doesn't surprise me

I wrapped it up and sent it

With a note saying ""I love you""

I meant it

Now I know what a fool I've been

But if you kissed me now

I know you'd fool me again",
67,Yo Gotti,Down in the DM,"
I tell her

Snapchat me that pussy...mood

Or Facetime me that pussy if it's...cool

(Whoo) Boy, my DM poppin' (DM poppin')

My DM just caught a body

I got celebs in this DM

They breakin' news if they see them

But nah we don't do no talkin' (we don't do no talkin')

We see sucker shit too often (fuck nigga)


I seen your girl post her BM

So I hit her in her DM

All eyes, yeah I see 'em

Yeah, that's your man? I'd hate to be him (whoop)

It goes down in the DM (it go down)

It go down in the DM (it go down, it go...down)

It goes down in the DM (it go down)

It go down in the DM (it go down, it go... down)",
406,Maroon 5,Memories,"
There's a time that I remember, when I did not know no pain

When I believed in forever, and everything would stay the same

Now my heart feel like December when somebody say your name

'Cause I can't reach out to call you, but I know I will one day, yeah


Everybody hurts sometimes

Everybody hurts someday, ayy-ayy

But everything gon' be alright

Go and raise a glass and say, ayy",
845,Billie Eilish,Lunch,"
Baby, I think you were made for me

Somebody write down the recipe

Been trying hard not to overeat

You're just so sweet

I'll run a shower for you like you want

Clothеs on the counter for you, try 'em on

If I'm allowеd, I'll help you take 'em off

Huh


I could eat that girl for lunch

Yeah, she dances on my tongue

Tastes like she might be the one

And I could never get enough

I could buy her so much stuff

It's a cravin', not a crush, huh",
606,Justin Bieber,Ghost,"
If I can't be close to you

I'll settle for the ghost of you

I miss you more than life

And if you can't be next to me

Your memory is ecstasy

I miss you more than life

I miss you more than life


Youngblood thinks there's always tomorrow

I need more time, but time can't be borrowed

I'd leave it all behind if I could follow",
103,The Chainsmokers,Something Just Like This,"
She said, where'd you wanna go?

How much you wanna risk?

I'm not looking for somebody

With some superhuman gifts

Some superhero

Some fairytale bliss

Just something I can turn to

Somebody I can kiss


I want something just like this

Doo-doo-doo, doo-doo-doo...",
574,Moneybagg Yo,Time Today,"
I don't like niggas, I don't like bitches

I don't like nobody (Nobody, Nobody)

We can get gangsta, we can keep it cordial

How you wanna go 'bout it? (How you wanna do it?)

I don't backtrack, man, fuck that, I don't miss nobody (I don't miss nothin')

Left it on seen, I ain't write back, I don't trust nobody (Period)


I just looked at my wrist, I got time today

Fuck it, I'm crossin' the line today

These bitches'll cry and be lyin' in your face (Facts)

Slicker than us, gotta know how they play

If the money wasn't straight, she wouldn't be here today

Ain't it man, sure know what to say

You ain't me so it's hard to relate (What?)

How much cash I fuck off every day? (Big Bagg)

Don't play with me, baby, go play with your pussy

You seen him in person these niggas be shooken

A huncho it cost you a Quavo to book me

I'm worth it, the proof in the pudding

Surrounded by bitches (Four of 'em)

I'm lookin' like William but that ain't my girlfriends (Nah)

Bruh, I'ma spin on your block, back to back when I finish it, look like the world end (Dawg)

I ain't ask for it, they did it to me (What?)

Niggas exposin' they hands for free

Get caught in the middle, that's bullseye (Get it too)

You got hit but we was targetin' he (Him)

Poppin' my shit with a capital P (Caps)

SRT, Redeye, red key (Vroom)

Might be ugly but my bitch precious (Bad)

She ain't even sneeze but still I bless her (Achoo)",
39,Drake,Controlla,"
I think I'd lie for you

I think I'd die for you

Jodeci ""Cry For You""

Do things when you want me to

Like controlla, controlla

Yeah, like controlla, controlla


Yeah, okay, you like it

When I get, aggressive, tell you to

Go slower, go faster

Like controlla, controlla

Yeah, like controlla, controlla",
327,Shawn Mendes,If I Can't Have You,"
Oh, I'm good at keeping my distance

I know that you're the feeling I'm missing

You know that I hate to admit it

But everything means nothing if I can't have you


I can't write one song that's not about you

Can't drink without thinking about you

Is it too late to tell you that

Everything means nothing if I can't have you?

I can't write one song that's not about you

Can't drink without thinking about you

Is it too late to tell you that

Everything means nothing if I can't have you?",
146,21 Savage,Bank Account,"
I got 1-2-3-4-5-6-7-8 M's in my bank account, yeah (Oh, God)

In my bank account, yeah (Oh God)

In my bank account, yeah (Oh God)

In my bank account, yeah (Oh God)

In my bank account, yeah (Oh God)

In my bank account, yeah (Oh God)

I got 1-2-3-4-5-6-7-8 shooters ready to gun you down, yeah (fast)

Ready to gun you down, yeah (Oh God)

Ready to gun you down, yeah (Oh God)

Ready to gun you down, yeah (Oh God)

Ready to gun you down, yeah (Oh God)

Ready to gun you down, yeah (Oh God)


Yeah dog I'm for real, dog (21)

Regular, buy the seats, I got a house on the hill, dog (21)

Wanna see a body, nigga? Get you killed, dog (wet)

Wanna Tweet about me, nigga? Get you killed, dog (wet)

Killed dog, I'm a real dog, you a lil' dog (21)

Be a dog, wanna be a dog, chasing mil's, dog

Dunk right in your bitch like O'Neal, dog

I shoot like Reggie Mill', dog (21)

Chopper sting you like a eel, dog",
718,PinkPantheress,Boy's a Liar Pt. 2,"
Every time I pull my hair

Well, it's only out of fear (Only out of fear)

That you'll find me ugly

And one day you'll disappear because

What's the point of crying?

It was nеver even lovе (It was never even love)

Did you ever want me?

Was I ever good enough? (Ever good enough?)


The-the boy's a liar, the boy's a liar

He doesn't see ya, you're not looking at me, boy

The boy's a liar, the boy's a liar

He doesn't see ya, you're not looking at me, boy",
444,Billie Eilish,Bad Guy,"
So you're a tough guy

Like a really rough guy

Just can't get enough guy

Chest always so puffed guy

I'm that bad type

Make your mama sad type

Make your girlfriend mad type

Might seduce your dad type

I'm the bad guy, duh

I'm the bad guy


I like it when you take control

Even if you know that you don't

Own me, I'll let you play the role

I'll be your animal

My mommy likes to sing along with me

But she won't sing this song

If she reads all the lyrics

She'll pity the men I know",
860,Artemas,I Like the Way You Kiss Me,"
You bite my lip, just for the taste

You're on your knees, I'm on the case

You take the heat, and with such grace

You say we'rе done, but here you stay

Said you'rе scared, I'll let you down (I'll let you down)

Stick around and you'll find out (And you'll find out)

But don't you wanna make me proud? (To make me proud)

'Cause I'm so proud, baby, I'm so proud of you


I like the way you kiss me, I can tell you miss me

I can tell it hits, hits, hits, hits

Not tryna be romantic, I'll hit it from the back

Just so you don't get attached ('Tached, 'tached, 'tached)

I like the way you kiss me, I can tell you miss me

I can tell it hits, hits, hits, hits

Not tryna be romantic, I'll hit it from the back

Just so you don't get attached ('Tached, 'tached, 'tached)",
465,Mariah Carey,All I Want for Christmas Is You,"
I don't want a lot for Christmas 

There is just one thing I need 

I don't care about presents 

Underneath the Christmas tree 

I don't need to hang my stocking 

There upon the fireplace 

Santa Claus won't make me happy 

With a toy on Christmas day 

I just want you for my own 

More than you could ever know 

Make my wish come true 

All I want for Christmas is you... 

You baby 


I won't ask for much this Christmas 

I won't even wish for snow 

I'm just gonna keep on waiting 

Underneath the mistletoe 

I won't make a list and send it 

To the North Pole for Saint Nick 

I won't even stay awake to 

Hear those magic reindeer click 

'Cause I just want you here tonight 

Holding on to me so tight 

What more can I do 

Baby all I want for Christmas is you 

You... ",
502,24kGoldn,Mood,"
I could never get attached

When I start to feel, I unattach

Somehow I always end up feeling bad

Baby, I am not your dad, it's not all you want from me

I just want your company

Girl, it's obvious, elephant in the room

And we're a part of it, don't act so confused

And you love startin' it, now I'm in a mood

Now we arguin' in my bedroom


We play games of love to avoid the depression

We been here before and I won't be your victim",
11,Lukas Graham,7 Years,"
Once I was eleven years old my daddy told me

Go get yourself a wife or you'll be lonely

Once I was eleven years old


I always had that dream like my daddy before me

So I started writing songs, I started writing stories

Something about the glory, just always seemed to bore me

Cause only those I really love will ever really know me",
416,Billie Eilish,Everything I Wanted,"
I had a dream

I got everything I wanted

But when I wake up, I see

You with me


And you say, ""As long as I'm here, no one can hurt you

Don't wanna lie here, but you can learn to

If I could change the way that you see yourself

You wouldn't wonder why you're here, they don't deserve you""",
896,Taylor Swift,Down Bad,"
Now I'm down bad, crying at the gym

Everything comes out teenage petulance

""Fuck it if I can't have him""

""I might just die, it would make no difference""

Down bad, waking up in blood

Staring at the sky, come back and pick me up

Fuck it if I can't have us

I might just not get up

I might stay down bad


Fuck it if I can't have him

Down bad

Fuck it if I can't have him",
230,Dan + Shay,Tequila,"
I can kiss somebody brand new 

And not even think about you

I can show up to the same bar

Hear the same songs in my car

Baby, your memory it only hits me this hard


When I taste tequila, baby I still see ya

Cutting up the floor in a Serotta t-shirt

The same one you wore when we were

Sky high in Colorado, your lips pressed against the bottle

Swearing on a Bible, baby, I'd never leave ya

I remember how bad I need ya, when I taste Tequila

When I taste Tequila",
189,Cheat Codes,No Promises,"
Oh na na, just be careful, na na

Love ain't simple, na na

Promise me no promises

Oh na na, just be careful, na na

Love ain't simple, nana

Promise me no promises


Baby I think about you

And I feel it, deep in my heart

Maybe we just ain't meant to be something

Maybe we are?",
437,Chris Brown,Go Crazy,"
Trips to your crib in the middle of the night

I know that you miss me as I put it down right

Damn, babe, I can put you on a flight

You know that a nigga like me can change your life


Oh, baby, everything you do is amazing

Ain't nobody watchin', go crazy

I got what you need

Everybody think you shy but I know you a freak

Lil' baby (Oh), everything you do is amazing (Yeah)

Ain't nobody watchin', go crazy (Yeah)

I got what you need (Yeah)

Everybody think you shy but I know you a freak

Lil' baby (Yeah)",
290,Ella Mai,Trip,"
But I think that I'm done trippin', I'm trip-trippin'

I've been sippin', that's how I control

This feelin', you keep givin'

You keep on hittin' it ooh, oh

Maybe it's your love, it's too good to be true

Baby boy, your love, got me trippin' on you

You know your love is big enough, make me trip up on you

Yeah, it's big enough, got me trippin' on you, trip-trippin' on you


My bad, my bad for, trippin' on you (trippin' on you)

My bad, my bad for, trippin' on you (trippin' on you)",
660,Megan Thee Stallion,Sweetest Pie,"
Baby, I'm the sweetest, pussy is the meanest (Yeah)

Hot girl shit, but I'm cold every season (But I'm)

Know he got that pipe, let him bust it 'til it's leakin' (Yeah, mwah)

Booty like a pillow, he can use it while he's sleepin' (Look)

Don't be goin' through my phone 'cause that's the old me (Old me)

Ain't the only one tryna be my one and only (Tryna)

Real thick, movin' slow, that body like codeine

He a player, but for Megan, he cuttin' the whole team (Hey, hey, hey, hey)

That body lookin' nice (Lookin' nice)

I got cake and I know he want a slice

I wish a nigga would try to put me on ice (Brrr)

I ain't never had to chase dick in my life (Dick in my life)

Want that nasty, that freaky stuff (Freaky stuff)

Live under my bed and keep me up (Hey)

That Hansel and Gretel, let him eat me up (Ah)

Uh, uh, uh, uh, uh


Ooh, this the ride of your life

Hold on 'cause, baby, I might

I might just give you a bite of the sweetest pie (Uh-huh)

Ooh, baby, we can go fast

I'll drive and you just lay back (Ah)

I got the flavour that lasts, yeah, the sweetest pie

I might take you home with this, I might give you all of it

Come get your dose of the sweetest pie

Ooh, this the ride of your life

Hold on 'cause, baby, I might

I might just give you a bite of the sweetest pie (Uh-huh, uh-huh)",
373,Pinkfong,Baby Shark,"
Daddy shark, doo doo doo doo doo doo

Daddy shark, doo doo doo doo doo doo

Daddy shark, doo doo doo doo doo doo

Daddy shark!


Grandma shark, doo doo doo doo doo doo

Grandma shark, doo doo doo doo doo doo

Grandma shark, doo doo doo doo doo doo

Grandma shark!",
